<?xml version="1.0" encoding="UTF-8"?>
<OpenMunicipio
	xmlns="http://www.w3schools.com"
	xmlns:xsi="http://www.w3.org/2001/XMLSchema-instance"
	xsi:schemaLocation="http://www.w3schools.com OpenMunicipioDataImport.xsd"
	xmlns:xi="http://www.w3.org/2001/XInclude">
	<Bodies>
		<Offices>
			<Office name="Ufficio Anagrafe" description="Elenco degli abitanti del comune">
				<Charge start_date="2012-01-01" end_date="2012-01-02" end_reason="too lazy" description="dipendente" >
					<Person ssn="BBBCCC00L26AASD1" last_name="Poppi" name="Pippo" birth_date="2000-07-26" sex="m" birth_place="Topolinia (TP)"/>
				</Charge>
				<Charge start_date="2012-01-01" end_date="2012-01-02" end_reason="too lazy" description="dirigente" >
					<Person ssn="BBBCCC00L26AASD1" last_name="Topolino" name="Topoloni" birth_date="2000-07-26" sex="m" birth_place="Topolinia (TP)"/>
				</Charge>
			</Office>
			<Office name="Un altro ufficio" description="Elenco degli abitanti del comune">
				<Charge start_date="2012-01-01" end_date="2012-01-02" end_reason="too lazy" description="dipendente" >
					<Person ssn="BBBCCC00L26AASD1" last_name="Poppi" name="Pippo" birth_date="2000-07-26" sex="m" birth_place="Topolinia (TP)"/>
				</Charge>
				<Charge start_date="2012-01-01" end_date="2012-01-02" end_reason="too lazy" description="dirigente" >
					<Person ssn="BBBCCC00L26AASD1" last_name="Topolino" name="Topoloni" birth_date="2000-07-26" sex="m" birth_place="Topolinia (TP)"/>
				</Charge>
			</Office>
		</Offices>
	</Bodies>
</OpenMunicipio>